ID,Fecha,Agente_Encargado_u_Origen,Deseo,Motivo,Registro_Consultado,Evaluacion_Tecnica,IRQ,Ruta_Resultante,Decision,Estado
WIRQ-2026-000,18/03/2026,mecanismo IRQ,Inicializacion del Wishlist IRQ,Apertura del mecanismo de control de ideas y deseos,REGISTRO_EVOLUCION_TECNICA_PROYECTO.csv,Entrada fundacional del sistema de wishlist,IRQ-4,aparcado,Queda abierto el sistema y preparada la cola de deseos,abierto
WIRQ-2026-001,18/03/2026,responsable del proyecto,Politica y protocolo de compatibilidad interlenguajes del Lenguaje SV con prioridad en Python Rust C C++ Kotlin y vigilancia de legado empresarial como Cobol,Cuando el lenguaje sea usable los desarrolladores agradeceran un ecosistema de APIs enganches y modulos puente; si no se ordena ahora luego sera mucho mas costoso,REGISTRO_EVOLUCION_TECNICA_PROYECTO.csv,La unidad encargada debe tratarlo como deseo estrategico de adopcion y ecosistema: no bloquea el nucleo actual pero exige politica temprana y constructor documental especifico para no generar deuda estructural futura,IRQ-2,activa,"Activar ya la politica y protocolo de compatibilidad interlenguajes, incorporar un tramo especifico al constructor del manual y diferir las implementaciones concretas por lenguaje a subtramos posteriores gobernados por evidencia y fase",abierto
WIRQ-2026-002,19/03/2026,responsable del proyecto,Patron clinico experto para SV: imagen de las celulas implicadas diagnostico del sistema SV y recomendacion de actuacion al experto humano,Conviene fijar desde ahora un caso rector de uso clinico que preserve soberania humana y permita orientar futuras interfaces diagnosticas y de recomendacion sin convertir al sistema en autoridad medica autonoma,REGISTRO_EVOLUCION_TECNICA_PROYECTO.csv,La unidad encargada lo clasifica como deseo estrategico de aplicacion clinica y de interfaz experta: no bloquea el cierre actual del lenguaje pero debe conservarse como caso rector para futuras fases de dominios e interfaces bajo supervision profesional explicita,IRQ-3,aparcado,Conservar como caso rector de aplicacion clinica experta y reabrir solo cuando el lenguaje cierre mejor su contrato diagnostico y exista fase legitima para interfaces o dominios medicos,abierto
WIRQ-2026-003,19/03/2026,responsable del proyecto,Capa de sinceridad SV sobre bases de datos empresariales como alternativa gobernada a capas de IA opacas o inestables para direccion y decision,Existe una necesidad estrategica de adopcion: ofrecer una capa interpretable y auditable sobre datos estructurados empresariales sin depender de cajas negras poco sinceras ante directivos y responsables,REGISTRO_EVOLUCION_TECNICA_PROYECTO.csv,La unidad encargada lo clasifica como deseo estrategico de adopcion y posicionamiento del lenguaje: no desplaza el cierre actual pero merece quedar activo como futura linea de politica de consulta y decision sobre datos estructurados,IRQ-2,activa,Mantener activa la linea en Wishlist y diferir su formalizacion como politica o tramo especifico hasta cerrar mejor el nucleo semantico-diagnostico del lenguaje,abierto
WIRQ-2026-004,19/03/2026,responsable del proyecto,Interfaz declarativa en lenguaje natural para programacion asistida del SV con previsualizacion de resultado y aceptacion explicita del desarrollador,Facilita que el desarrollador exprese intenciones o deseos en lenguaje natural y conserve el control final mediante visualizacion previa y decision humana explicita antes del cierre de tarea,REGISTRO_EVOLUCION_TECNICA_PROYECTO.csv,La adversarial corrige la primera intuicion: no es IRQ-1 porque no sanea una rotura proxima del nucleo, pero si es una linea estrategica fuerte de adopcion y soberania humana sobre el flujo de programacion asistida,IRQ-2,activa,Mantener activa la linea de diseno y criterios de interfaz declarativa; no abrir implementacion todavia mientras el contrato diagnostico del lenguaje no alcance mayor estabilidad,abierto
WIRQ-2026-005,19/03/2026,responsable del proyecto,Shell y entorno interactivo del lenguaje SV orientado al desarrollador con ayuda contextual solo bajo demanda explicita,Permite un entorno amigable y alineado con habitos actuales de tooling sin ayuda intrusiva ni dependencia de asistencia constante,REGISTRO_EVOLUCION_TECNICA_PROYECTO.csv,La unidad encargada lo clasifica como necesidad fuerte de experiencia de desarrollador pero subordinada a la definicion previa de la interfaz declarativa y al saneamiento del nucleo del lenguaje,IRQ-3,activa,Mantener como linea activa subordinada a WIRQ-2026-004 y diferir su concrecion tecnica hasta que exista base mas estable de flujo y tooling del lenguaje,abierto
WIRQ-2026-006,19/03/2026,responsable del proyecto,Capacidad de trabajo sincronizado local y remoto del ecosistema de desarrollo SV,Es una necesidad relevante a medio plazo pero dependiente de decisiones estructurales e infraestructurales que no deben abrirse antes de madurar la interaccion declarativa y el entorno propio del desarrollador,REGISTRO_EVOLUCION_TECNICA_PROYECTO.csv,La adversarial la desplaza a aparcamiento largo: no es mejora compatible inmediata sino linea dependiente de infraestructura ausente y de decisiones previas aun no legitimadas,IRQ-6,aparcado,Mantener aparcada hasta que el lenguaje cumpla antes WIRQ-2026-004 y WIRQ-2026-005 y exista decision expresa sobre infraestructura y sincronizacion de estado,abierto
