ID,Fecha,Hora_Europe_Madrid,Tipo_Hito,Frente_Fase,Resumen_Cambio,Motivo_Argumento,Base_Doctrinal_Tecnica,Artefactos_Afectados,Evidencia,Impacto,Objecion_Adversarial,Decision,Estado
RETP-2026-041,24/03/2026,21:42:51,CAMBIO_DOCUMENTACION_PUBLICA_Y_CONCORDANCIA_DIAGNOSTICA,Frente final del lenguaje SV / Microparche documental rebasado del contrato diagnóstico visible / Fase IV,"Se resincroniza la documentación viva del contrato diagnóstico observable para reflejar la emitibilidad y cobertura explícita ya acreditadas de E102 E104 E208 E209 y E303, corrigiendo además los nombres implementativos stale de E102 y E104 en catálogo y matriz.","La lectura adversarial del árbol del repositorio verificado mostró que el árbol ya acredita materialmente esos cinco códigos por suite y validator, mientras varios documentos vivos seguían describiendo un estado anterior o arrastraban nombres implementativos ya no vigentes.",src/svp_errors.py; tests/run_conformance.py; tests/conformance/invalid/output_semantics_no_declarada.svp; tests/conformance/invalid/conector_target_no_ternario.svp; tests/conformance/invalid/compose_relations_vacias.svp; tests/conformance/invalid/compose_patterns_vacios.svp; tests/conformance/invalid/transition_data_horizon_no_declarado.svp; árbol del repositorio verificado auditado con suite en verde.,docs/referencia/ERRORES_CANONICOS_SV_v0_2.md; docs/calidad/MATRIZ_DE_CONCORDANCIA_DIAGNOSTICA_IR_IMPLEMENTACION_SV.md; docs/calidad/MATRIZ_DE_CONCORDANCIA_DIAGNOSTICA_IR_IMPLEMENTACION_SV.csv; docs/calidad/DICTAMEN_DE_SANEAMIENTO_DEL_BLOQUE_A_CONTRATO_DIAGNOSTICO.md; docs/calidad/ACTA_TECNICA_DE_SINCRONIZACION_DOCUMENTAL_DEL_CONTRATO_DIAGNOSTICO_VISIBLE_2026_03_24.md; docs/calidad/README.md; docs/calidad/REGISTRO_EVOLUCION_TECNICA_PROYECTO.md; docs/calidad/REGISTRO_EVOLUCION_TECNICA_PROYECTO.csv.,lectura VERIFICACION_INTEGRAL del árbol del repositorio verificado con contraste corto sobre src/svp_errors.py tests/run_conformance.py los casos inválidos afectados y la documentación viva; ejecución local posterior de tests/run_conformance.py 37/37 tests/run_cli_smoke.py 3/3 y tests/run_sec0_smoke.py 3/3 sin regresión.,coherencia_diagnostica; sincronizacion_documental; trazabilidad; control_de_calidad.,Riesgo de sobreactuar este lote como si implicara convergencia semántica plena con la IR v0.2 o reescritura silenciosa de historia cerrada. No procede: el lote se limita a resincronizar documentación viva y a añadir nota posterior explícita en el dictamen.,Abrir y cerrar como lote separado un microparche documental rebasado que sincronice el contrato diagnóstico visible sin tocar código ni mezclar otros frentes.,cerrado
RETP-2026-042,26/03/2026,13:26:00,DECISION_GOBIERNO_TECNICO,Lenguaje SV / sellado técnico mínimo prebackend y reordenación de continuidad tras la familia VII / Fase IV,"Se crea el bloque mínimo de gobierno para cerrar provisionalmente PC-HNA, registrar nueva deuda viva semántica y complementar el rumbo prebackend, fijando además que el siguiente frente correcto será la pieza marco de células especializadas y no NLP.","La doble auditoría externa y la consolidación de la familia VII muestran que el riesgo ya no está en el bloque congelado previamente saneado, sino en avanzar hacia frentes de alta presión semántica sin sellar antes el fundamento mínimo del lenguaje ni corregir expresamente el orden de continuidad.",árboles de repositorio verificados de SV-lenguaje-de-computacion y SV-matematica-semantica; documentación de calidad vigente; doble auditoría externa absorbida por la coordinación técnica; familia VII consolidada hasta su pieza más reciente.,docs/calidad/ACTA_TECNICA_DE_CIERRE_PROVISIONAL_DE_PC_HNA_Y_CONDICIONES_DE_REAPERTURA_2026_03_26.md; docs/calidad/ACTA_TECNICA_COMPLEMENTARIA_DE_CONTINUIDAD_TRAS_LA_FAMILIA_VII_Y_REORDENACION_DEL_RUMBO_PREBACKEND_2026_03_26.md; docs/calidad/DEUDA_VIVA_HITOS_LENGUAJE_SV.csv; docs/calidad/MATRIZ_UCBC_HORIZONTES_LENGUAJE_SV.csv; docs/calidad/ESPEJO_DOCTRINAL_COLECCIONES_LENGUAJE_SV.md; docs/calidad/README.md; docs/calidad/REGISTRO_EVOLUCION_TECNICA_PROYECTO.md; docs/calidad/REGISTRO_EVOLUCION_TECNICA_PROYECTO.csv; docs/calidad/REGISTRO_PARTES_DE_TRABAJO_POR_AGENTE.csv,"lectura VERIFICACION_INTEGRAL de árboles de repositorio verificados; triple contraste con auditorías externas; verificación de coherencia interna entre actas, deuda viva, matriz de horizontes, espejo doctrinal y README de calidad.",gobierno_tecnico; trazabilidad; continuidad_operativa; resiliencia_prebackend; cautela_semantica,"Riesgo de retrasar innecesariamente el proyecto con teoría total prematura, o de reordenar la continuidad por intuición sin dejar rastro explícito. No procede ninguno de los dos extremos: se fija un sellado técnico mínimo y una corrección de secuencia limitada, documentada y no implementativa.","Cerrar provisionalmente PC-HNA, abrir deuda viva semántica mínima y complementar el rumbo prebackend para que la siguiente pieza lógica sea la publicación marco de células especializadas.",cerrado
RETP-2026-043,26/03/2026,17:57:47,CAMBIO_DOCUMENTACION_PUBLICA,Lenguaje SV / sincronización del espejo doctrinal de células especializadas y alta registral de nota de hoja de ruta / Fase IV,"Se sincronizan README y espejo doctrinal del repo técnico con la publicación pública ya activa de la colección Células especializadas del Sistema Vectorial SV, se corrige EDCL-004 con la URL específica de release_1 y se registra formalmente la nota de hoja de ruta sobre la célula de verificación formal y generación matemática.","Tras el cierre del Lote A en la sede doctrinal, el repo técnico mantenía una narrativa stale de continuidad preparada para la colección celular y afirmaba ya en EDCL-004 una alta registral de la nota que todavía no constaba en el registro maestro.",árbol del repositorio verificado de SV-lenguaje-de-computacion; árbol del repositorio verificado de SV-matematica-semantica ya saneado en su sede ASCII; nota de hoja de ruta ya presente en docs/calidad; espejo doctrinal y README de calidad vigentes.,docs/calidad/README.md; docs/calidad/ESPEJO_DOCTRINAL_COLECCIONES_LENGUAJE_SV.md; docs/calidad/ESPEJO_DOCTRINAL_COLECCIONES_LENGUAJE_SV.csv; docs/calidad/REGISTRO_EVOLUCION_TECNICA_PROYECTO.md; docs/calidad/REGISTRO_EVOLUCION_TECNICA_PROYECTO.csv.,lectura VERIFICACION_INTEGRAL de árboles de repositorio verificados; contraste entre README de calidad espejo doctrinal y EDCL-004; verificación de que la nota ya existía materialmente sin alta efectiva en el registro maestro; contraste con la sede doctrinal ASCII ya saneada.,trazabilidad; sincronizacion_documental; gobierno_tecnico; continuidad_operativa.,"Riesgo de sobreactuar la publicación de la colección celular como autorización automática para abrir células específicas o para adelantar implementación. No procede: el lote se limita a sincronizar estado público y registro técnico, manteniendo la cautela de implementación y la subordinación a D-07, D-08 y al perfil funcional mínimo.",Cerrar como lote registral y documental separado la absorción técnica de la colección pública de células especializadas y dejar formalmente asentada la nota de hoja de ruta ya existente.,cerrado
RETP-2026-044,26/03/2026,NO_CONSTA,SANEAMIENTO_REGISTRAL_Y_ASENTAMIENTO_FINAL_DE_CICLO,Lenguaje SV / asentamiento final del ciclo UCBC12 y apertura trazable del piloto de seguridad estructural / Fase IV,"Se integra el Acta técnica como instrumento activo del bloque de calidad, se restaura el registro técnico en prosa como fuente legible coordinada con el CSV maestro y se sincroniza la sede doctrinal de células especializadas para reflejar ya la microauditoría de apertura del piloto de seguridad estructural.","Tras la urgencia ética y registral del ciclo UCBC12 permanecían tres asimetrías materiales: el README doctrinal de la sede celular seguía declarando que la carpeta contenía sólo README.md, el README de calidad no listaba todavía el Acta ya publicada y el registro técnico en prosa había quedado sustituido por la nota de hoja de ruta, perdiendo su función de lectura humana coordinada.",árbol del repositorio verificado de SV-lenguaje-de-computacion; evidencia documental verificable de la sede doctrinal celular ya publicada en GitHub; Acta técnica final ya publicada; microauditoría de apertura del piloto de seguridad estructural ya materialmente presente en la sede doctrinal; criterio de no bloqueo de la deuda IR relativo a la compuerta entre prohibición y protección.,documentos/celulas_especializadas_sv/README.md en SV-matematica-semantica; docs/calidad/README.md; docs/calidad/REGISTRO_EVOLUCION_TECNICA_PROYECTO.md; docs/calidad/REGISTRO_EVOLUCION_TECNICA_PROYECTO.csv; docs/calidad/ACTA_TECNICA_DE_PROHIBICION_ABSOLUTA_DE_USO_BELICO_Y_PRIMACIA_DE_SUPERVIVENCIA_HUMANA_EN_EL_SV_2026_03_26.md.,"lectura VERIFICACION_INTEGRAL del árbol del repositorio verificado de Lenguaje SV; verificación acotada de la sede doctrinal celular mediante evidencia documental verificable verificable; triple contraste adversarial entre README, registro técnico, Acta publicada y microauditoría del piloto.",trazabilidad; saneamiento_registral; continuidad_operativa; gobierno_tecnico; cautela_semantica; preservacion_editorial.,"Riesgo de prolongar la unidad UCBC12 con una zona gris entre publicación ética, apertura del piloto y registro maestro, o de convertir la deuda IR futura en bloqueo inmediato del sistema. No procede ninguno de los dos extremos: el lote sólo asienta, sincroniza y deja explícita la continuidad no bloqueante.","Cerrar el asentamiento final del ciclo UCBC12 antes del relevo, dejando el Acta absorbida como límite superior, la sede celular actualizada y el registro técnico nuevamente legible y coordinado con el CSV maestro.",cerrado
RETP-2026-045,29/03/2026,09:09:15,SANEAMIENTO_DE_LENGUAJE_PUBLICO_Y_COORDINACION_INTERNA,Lenguaje SV / saneamiento del lenguaje público en docs/calidad y completitud de la coordinación con SVperitus / Fase IV,"Se regulariza el lenguaje público de la sede de calidad del lenguaje, sustituyendo formulaciones internas por expresiones aptas para terceros y completando la indexación interna de las piezas de coordinación ya abiertas con SVperitus.","La revisión adversarial del bloque de calidad mostró cocina interna residual en la taxonomía de verificación, en los registros históricos y en varias actas públicas, además de ausencia de indexación de las piezas nuevas de coordinación entre sedes.",docs/calidad/README.md; docs/calidad/REGISTRO_PARTES_DE_TRABAJO_POR_AGENTE.md; docs/calidad/REGISTRO_PARTES_DE_TRABAJO_POR_AGENTE.csv; docs/calidad/REGISTRO_EVOLUCION_TECNICA_PROYECTO.md; docs/calidad/REGISTRO_EVOLUCION_TECNICA_PROYECTO.csv; docs/calidad/REGISTRO_BARRIDOS_DE_ACTIVIDAD_Y_LATENCIA_DEL_REPO.md; docs/calidad/REGISTRO_BARRIDOS_DE_ACTIVIDAD_Y_LATENCIA_DEL_REPO.csv; actas y matrices afectadas del bloque de calidad.,docs/calidad/README.md; docs/calidad/REGISTRO_PARTES_DE_TRABAJO_POR_AGENTE.md; docs/calidad/REGISTRO_PARTES_DE_TRABAJO_POR_AGENTE.csv; docs/calidad/REGISTRO_EVOLUCION_TECNICA_PROYECTO.md; docs/calidad/REGISTRO_EVOLUCION_TECNICA_PROYECTO.csv; docs/calidad/REGISTRO_BARRIDOS_DE_ACTIVIDAD_Y_LATENCIA_DEL_REPO.md; docs/calidad/REGISTRO_BARRIDOS_DE_ACTIVIDAD_Y_LATENCIA_DEL_REPO.csv; docs/calidad/ACTA_DE_ACTIVACION_DEL_CONTROL_DE_BARRIDOS_Y_PARTES_POR_AGENTE_2026_03_23.md; docs/calidad/ACTA_TECNICA_DE_VERIFICACION_DEL_HITO_1_BASE_SEGURA_2026_03_23.md; docs/calidad/ACTA_TECNICA_DE_AUTORIZACION_RESTRINGIDA_DE_APERTURA_DE_H2_2026_03_23.md; docs/calidad/ACTA_TECNICA_DE_MICROAUDITORIA_H2_PRE_NO_BLOQUEO_2026_03_23.md; docs/calidad/ACTA_TECNICA_DE_SINCRONIZACION_DOCUMENTAL_DEL_CONTRATO_DIAGNOSTICO_VISIBLE_2026_03_24.md; docs/calidad/ACTA_TECNICA_DE_REGULARIZACION_REGISTRAL_DEL_CICLO_VII_Y_REGLA_DE_INSPECCION_REAL_DE_ZIP_2026_03_24.md; docs/calidad/ACTA_DE_SANEAMIENTO_DE_CONCORDANCIA_DEL_BLOQUE_PLIEGO_MANUAL_RETP_2026_010_2026_03_20.md; docs/calidad/ACTA_TECNICA_DE_CIERRE_AUDITADO_DEL_PARCHE_CORRECTIVO_DEL_FRONTEND_2026_03_23.md; docs/calidad/ACTA_TECNICA_DE_CONSOLIDACION_AUDITADA_DE_H2_RESTRINGIDO_2026_03_23.md; docs/calidad/DICTAMEN_DE_SANEAMIENTO_DEL_BLOQUE_A_CONTRATO_DIAGNOSTICO.md; docs/calidad/MATRIZ_DE_CONCORDANCIA_DIAGNOSTICA_IR_IMPLEMENTACION_SV.md; docs/calidad/MATRIZ_DE_VIGILANCIA_TEMPRANA_UCBC_INTERFACES_LENGUAJE_SV.md; docs/calidad/ACTA_TECNICA_DE_ACOPLAMIENTO_MINIMO_DEL_CONTROL_DE_CALIDAD_DE_SVPERITUS_A_LA_SEDE_LOGISTICA_DEL_LENGUAJE_SV_2026_03_28.md; docs/calidad/NOTA_DE_COORDINACION_ENTRE_LA_SEDE_LOGISTICA_DEL_LENGUAJE_SV_Y_EL_CONTROL_MINIMO_DE_CALIDAD_DE_SVPERITUS_2026_03_28.md; docs/calidad/REGISTRO_DE_COORDINACION_ENTRE_SEDES_APLICADAS_Y_SEDE_LOGISTICA_DEL_LENGUAJE_SV.csv.,Verificación integral del bloque de calidad con contraste textual y validación posterior de consistencia CSV en las piezas afectadas.,trazabilidad; lenguaje_publico; coordinacion_entre_sedes; control_de_calidad.,"Riesgo de alterar el contenido registral histórico al sanear únicamente la forma pública. No procede reescribir hechos ni secuencias; el saneamiento se limita a nomenclatura de verificación, formulación pública e indexación interna.","Regularizar el lenguaje público de docs/calidad y dejar explícita la coordinación interna con SVperitus sin reabrir doctrina, IR, validator, runner ni backend.",cerrado
