PARTE_ID,Fecha,Hora_Europe_Madrid,Agente,Lectura_Repo_Fresco,Alcance_Declarado,Repo_Fresco_Usado,Actuaciones_Desde_Ultimo_Control_Secuencial,Actuaciones_Ejecutadas,Artefactos_Leidos,Resultado,Observaciones
PTA-2026-001,23/03/2026,16:59:50,Agente WLenguaje7 SV,100_REAL,"Evaluación del control adicional de barridos, lectura fresca y partes por agente; integración con H2-pre y con la traza de calidad del ciclo pre-backend.",repo fresco vigente auditado en el ciclo de formalización H1/H2-pre,Desde el último control secuencial formal no constaba todavía un registro específico de barrido ni de partes por agente dentro del árbol.,Evaluación de utilidad; adversarial; diseño de taxonomía de lectura fresca; propuesta e institucionalización de barridos secuenciales y partes por agente; integración con el registro maestro.,README.md; docs/README.md; docs/calidad/README.md; docs/calidad/REGISTRO_EVOLUCION_TECNICA_PROYECTO.md; docs/calidad/REGISTRO_EVOLUCION_TECNICA_PROYECTO.csv; docs/calidad/REGISTRO_CALIDAD_HITOS_LENGUAJE_SV.csv; repo fresco completo en lectura de control.,Procede institucionalizar el control adicional sin inflar indebidamente la burocracia y sin apoyarse en fechas brutas del ZIP.,Este parte inicial deja trazabilidad suficiente del arranque del sistema de partes por agente.
PTA-2026-002,23/03/2026,17:45:05,Agente WLenguaje7 SV,100_REAL,Auditoría H2-A y formalización de la autorización restringida de apertura de H2 como frente arquitectónico-auditor de trabajo.,"repo fresco vigente auditado tras la integración de H1, H2-pre, barridos y partes por agente.",Desde el último control secuencial se consolidó H2-pre como no bloqueo y se mantuvo la estabilidad técnica y documental del árbol sin hallazgos materiales de descoordinación.,Lectura completa del repo fresco; adversarial sobre autorización de H2; dictamen positivo de apertura restringida; preparación del lote registral y documental correspondiente.,README.md; docs/README.md; docs/arquitectura/README.md; docs/calidad/README.md; docs/index.html; docs/calidad/REGISTRO_CALIDAD_HITOS_LENGUAJE_SV.csv; docs/calidad/REGISTRO_EVOLUCION_TECNICA_PROYECTO.md; docs/calidad/REGISTRO_EVOLUCION_TECNICA_PROYECTO.csv; repo fresco completo en lectura de control.,Procede autorizar la apertura restringida de H2 sin marcar H2 como verificado y sin apertura automática del backend.,Este parte deja trazabilidad suficiente del paso desde H2-pre a H2-A.
PTA-2026-003,23/03/2026,20:02:35,Agente WLenguaje8 SV,100_REAL,"Aplicación, verificación posterior y cierre registral del parche correctivo funcional acotado del frontend.",repo fresco vigente auditado tras la aplicación material del lote correctivo del frontend.,Desde el último control secuencial se mantenía H2 restringido consolidado y quedó abierto un lote correctivo local del frontend por auditoría externa contrastada.,Lectura corta del repo fresco; contraste fino de validator y tests; preparación del lote mínimo; verificación posterior del árbol actualizado; dictamen de cierre; preparación del microparche registral de acta y registros.,src/svp_errors.py; src/svp_parser.py; src/svp_validator.py; tests/run_conformance.py; tests/conformance/invalid/; tests/conformance/valid/; docs/calidad/PROCEDIMIENTO_AUDITORIA_TECNICA_SV.md; docs/calidad/REGISTRO_EVOLUCION_TECNICA_PROYECTO.md; docs/calidad/REGISTRO_EVOLUCION_TECNICA_PROYECTO.csv; docs/calidad/REGISTRO_BARRIDOS_DE_ACTIVIDAD_Y_LATENCIA_DEL_REPO.csv; docs/calidad/REGISTRO_PARTES_DE_TRABAJO_POR_AGENTE.csv; repo fresco completo en lectura de control.,"Procede cerrar y registrar el parche como lote terminado, sin reabrir H2 ni mezclar regularización amplia del contrato diagnóstico.",Este parte deja trazabilidad suficiente del paso desde la corrección funcional visible hasta su cierre registral y auditado.
PTA-2026-004,24/03/2026,08:48:50,Agente WBeta SV-UCBC8,100_REAL,"Cierre del primer paquete VII, implantación de gobierno semántico en el Lenguaje SV y regularización de reglas de no repetición tras detectar inferencias indebidas y errores de lectura material.","repo fresco vigente del Lenguaje SV auditado en lectura completa de control, más repos frescos y CSV/HTML/PDF materiales del frente doctrinal VII.","Desde el último control secuencial se cerró el primer paquete doctrinal VII en publicaciones y registros; se abrió una capa de gobierno semántico para el Lenguaje SV y se detectaron errores operativos del agente relativos a ZIP, verificación material y precisión del protocolo GitHub.",Lectura real de repos frescos; auditoría y adversarial de releases VII; implantación de capa de gobierno semántico en docs/calidad; regularización de registros; identificación explícita de errores del agente; fijación de reglas de no repetición para futuros relevos.,docs/calidad/REGISTRO_PARTES_DE_TRABAJO_POR_AGENTE.md; docs/calidad/REGISTRO_PARTES_DE_TRABAJO_POR_AGENTE.csv; docs/calidad/README.md; docs/calidad/ESPEJO_DOCTRINAL_COLECCIONES_LENGUAJE_SV.md; docs/calidad/ESPEJO_DOCTRINAL_COLECCIONES_LENGUAJE_SV.csv; docs/calidad/MATRIZ_UCBC_HORIZONTES_LENGUAJE_SV.csv; docs/calidad/REGISTRO_EVOLUCION_TECNICA_PROYECTO.md; docs/calidad/REGISTRO_EVOLUCION_TECNICA_PROYECTO.csv; repos frescos doctrinales y del lenguaje; HTML y CSV frescos descargados de GitHub.,Procede dejar trazabilidad explícita de errores de inferencia y de lectura material para impedir su repetición por agentes posteriores. Queda fijada la regla de inspección real de todo ZIP y de prevalencia del contenido interno del objeto sobre su nombre externo o sobre la memoria del agente.,Este parte cierra el ciclo operativo de WBeta SV-UCBC8 y deja instrucción preventiva directa para el relevo.
PTA-2026-005,25/03/2026,07:15:00,Agente WBeta SV-UCBC9,100_REAL,"Consolidación doctrinal y editorial de la familia VII hasta VII.3, apertura y saneamiento de matriz madre y espejo de sucesos, prueba de estrés al Lenguaje SV y preparación de continuidad hacia VII.4 y células especializadas.","repos frescos vigentes de SV-matematica-semantica y SV-lenguaje-de-computacion auditados materialmente, más CSV, HTML, PDF y manuscritos frescos del frente VII.","Desde el último control secuencial se abrió el frente VII.3, se integraron y corrigieron materiales doctrinales de la familia VII, se cargaron y auditaron matriz madre y espejo, y se ejecutó contraste real entre ese frente y el Lenguaje SV.","Lectura real de repos frescos; adversariales sucesivas sobre VII.3; saneamiento de README y artefactos de la familia VII; corrección de manuscritos desde HTML soberano; apertura, carga y microauditoría de matriz madre y espejo; prueba de estrés al Lenguaje SV; dictamen de continuidad hacia VII.4 y células especializadas; preparación de relevo a WBeta SV-UCBC10.","documentos/sucesos_horizontes_y_cambio_estructural/README.md; documentos/sucesos_horizontes_y_cambio_estructural/REGISTRO_EDITORIAL_COLECCION_SUCESOS.csv; documentos/sucesos_horizontes_y_cambio_estructural/matriz_capa_sucesos/README.md; documentos/sucesos_horizontes_y_cambio_estructural/matriz_capa_sucesos/MATRIZ_MADRE_EXTRACCION_DOCTRINAL_SUCESOS.csv; documentos/sucesos_horizontes_y_cambio_estructural/matriz_capa_sucesos/MATRIZ_ESPEJO_CONTRASTE_LENGUAJE_SV.csv; documentos/sucesos_horizontes_y_cambio_estructural/VII.0/; documentos/sucesos_horizontes_y_cambio_estructural/VII.1/; documentos/sucesos_horizontes_y_cambio_estructural/VII.2/; documento VII.3 y sus artefactos de publicación; docs/calidad/README.md; docs/calidad/REGISTRO_PARTES_DE_TRABAJO_POR_AGENTE.csv; docs/calidad/ESPEJO_DOCTRINAL_COLECCIONES_LENGUAJE_SV.md; docs/calidad/MATRIZ_UCBC_HORIZONTES_LENGUAJE_SV.csv; repos frescos doctrinales y del lenguaje; HTML, CSV y PDF frescos descargados de GitHub.",Procede declarar consolidada la familia VII hasta VII.3 y suficientemente tensado el contraste con el Lenguaje SV. Queda justificada la apertura de VII.4 como siguiente frente correcto y la siembra fuerte del carril doctrinal de células especializadas del Sistema Vectorial SV.,"Este parte deja trazabilidad suficiente del cierre operativo de WBeta SV-UCBC9, de sus principales aciertos y de los riesgos evitados: no tratar al Lenguaje SV como vacío, no darlo por clausurado y no abrir VII.4 sin haber ejecutado antes la matriz y la prueba de estrés correspondientes."
PTA-2026-006,25/03/2026,21:07:32,Agente WBeta SV-UCBC10,100_REAL,"Consolidación doctrinal, editorial y técnica de la familia VII desde VII.4 hasta el frente VII.5; saneamiento de README/matriz; corrección de espejos GitHub desde HTML soberano; preparación del relevo hacia VII.6.","repos frescos vigentes de SV-matematica-semantica y SV-lenguaje-de-computacion auditados materialmente, más HTML, ZIP, PDF, CSV y manuscritos frescos de VII.4 y VII.5.","Desde el último control secuencial se recibió la familia VII consolidada hasta VII.3 con matriz y prueba de estrés al Lenguaje SV; se abrió VII.4, se integró y saneó su sede canónica, se resolvieron conflictos de merge y compatibilidad Markdown, se auditó y fortaleció VII.5 con laboratorio y segunda ronda tras auditoría externa, y se preparó la continuidad hacia VII.6.","Lectura real de repos frescos; integración material y saneamiento editorial de VII.4 desde HTML soberano; corrección de README de familia y de matriz de sucesos; resolución de conflicto residual de merge; auditoría forense de laboratorio y manuscrito de VII.4; delimitación, revisión troncal y segunda ronda de VII.5 con absorción de auditoría externa; preparación de espejo canónico para GitHub Desktop; corrección final de renderizado matemático inline y compatibilidad de GitHub; fijación del siguiente punto de decisión y preparación del relevo hacia VII.6.","documentos/sucesos_horizontes_y_cambio_estructural/README.md; documentos/sucesos_horizontes_y_cambio_estructural/REGISTRO_EDITORIAL_COLECCION_SUCESOS.csv; documentos/sucesos_horizontes_y_cambio_estructural/matriz_capa_sucesos/README.md; documentos/sucesos_horizontes_y_cambio_estructural/VII.4/; documentos/sucesos_horizontes_y_cambio_estructural/VII.5/; documentos/sucesos_horizontes_y_cambio_estructural/matriz_capa_sucesos/MATRIZ_MADRE_EXTRACCION_DOCTRINAL_SUCESOS.csv; documentos/sucesos_horizontes_y_cambio_estructural/matriz_capa_sucesos/MATRIZ_ESPEJO_CONTRASTE_LENGUAJE_SV.csv; docs/calidad/README.md; docs/calidad/REGISTRO_PARTES_DE_TRABAJO_POR_AGENTE.csv; repos frescos doctrinal y del lenguaje; HTML, PDF, ZIP, CSV y manuscritos frescos descargados de GitHub y PubPub.","Procede declarar plenamente estabilizado VII.4 en la sede canónica y suficientemente fortalecido VII.5 como siguiente pieza seria de la familia, con espejo canónico preparado y corregido para GitHub. El siguiente paso correcto es cerrar registralmente este ciclo y someter el tronco de VII.6 a auditoría fuerte antes de cualquier redacción final.","Este parte deja trazabilidad de los principales errores evitados y corregidos: no confundir HTML con .md soberano, no dar por limpio un merge sin lectura material, no tolerar notación matemática mal renderizada en GitHub y no inferir estructura interna del documento por arrastre desde VII.4. Queda como guardarraíl para el relevo que VII.6 debe abrirse desde problema propio, tríada mínima de relaciones, ejemplos SV(9,3) y laboratorio acompañante."
