ID,Hito,Control,Criterio de verificación,Evidencia esperada,Estado,Observaciones
Q-01,H1,Gramática mínima estable,No se han añadido categorías nuevas por presión semántica futura,Diff o auditoría sin ampliación sintáctica impropia,Pendiente,
Q-02,H1,IR no incompatible con relaciones y acumulaciones,No existe fijación que impida representar relaciones o acumulaciones futuras,Revisión técnica de nodos y lowering,Pendiente,
Q-03,H1,Validator no temporalista,No presupone linealidad fuerte o uniformidad de transición,Auditoría de reglas y errores,Pendiente,
Q-04,H2,IR preparada para familias de propiedades,No impide futura agrupación localizada,Microauditoría estructural,Pendiente,
Q-05,H2,Runner no presupone continuidad uniforme,Tolera patrones de transición no banales,Auditoría de ejecución,Pendiente,
Q-06,H3,Puntos de extensión claros,Hay puntos de ampliación sin rehacer arquitectura,Nota técnica o comentario de diseño,Pendiente,
Q-07,H3,Backend no hipotecado,No existen decisiones irreversibles incompatibles con horizontes identificados,Revisión de estructuras persistentes,Pendiente,
