titulo,doi_o_enlace,motivo,accion
"Análisis preliminar de elementos químicos, materiales y aleaciones de nueva generación para usos médicos y científicos",https://doi.org/10.17613/8ryyb-g9h48,Pendiente de fijar fecha canónica exacta y relación con química factual/materiales antes de incorporar.,Verificar en GitHub/Zenodo y decidir colección principal.
"Interacción, intercomposición y transmisión factual entre campos en el Sistema Vectorial SV",https://doi.org/10.21428/39829d0b.293e914a,"Pendiente de verificar fecha, título canónico completo y enlace principal.",Abrir como candidato prioritario del siguiente lote.
Imperfección preformal y espacio,https://doi.org/10.21428/39829d0b.9c57c046,Publicación de fundamentos de alto rango; requiere fila cuidada y no debe absorberse como simple referencia.,Incorporar en lote específico de fundamentos.
Teoría del TODO y de la NADA en el Sistema Vectorial SV,https://doi.org/10.17613/k3q1d-fjj45,Publicación fundacional; requiere clasificación y función SV precisa.,Incorporar en lote específico de fundamentos.
Primitivos metrológicos del Sistema Vectorial SV,https://doi.org/10.21428/39829d0b.c8ec692e,Publicación metrológica transversal; requiere relación con cosmometría y retornos físicos.,Incorporar en lote de metrología/fundamentos.
